,symbol,sector,industry,volume,profitMargins,shortName,longName,exchange
1114,0201.HK,Consumer Cyclical,Lodging,24000,0.43971002,MAGNIFICENT,Magnificent Hotel Investments Limited,HKG
1115,0202.HK,Real Estate,Real Estate Services,150000,-2.47865,EVERCHINA INT'L,EverChina Int'l Holdings Company Limited,HKG
1116,0204.HK,Financial Services,Asset Management,6486000,0.0,CHINA INV DEV,China Investment Development Limited,HKG
1117,0205.HK,Communication Services,Advertising Agencies,540000,-0.59311,SEEC MEDIA,SEEC Media Group Limited,HKG
1118,0206.HK,Energy,Oil & Gas Equipment & Services,440000,-0.43724,CMIC OCEAN,"CMIC Ocean En-Tech Holding Co., Ltd.",HKG
1119,0207.HK,Real Estate,Real Estate—Diversified,2622626,0.13559,JOY CITY PPT,Joy City Property Limited,HKG
1120,0208.HK,Real Estate,Real Estate—Development,154000,1.0382199,POLYTEC ASSET,Polytec Asset Holdings Limited,HKG
1121,0209.HK,Consumer Cyclical,Leisure,351060000,-0.3518,WINSHINE SCI,Winshine Science Company Limited,HKG
1122,0210.HK,Consumer Cyclical,Footwear & Accessories,1886000,-0.2726,DAPHNE INT'L,Daphne International Holdings Limited,HKG
1123,0211.HK,Financial Services,Capital Markets,5340000,0.17826,STYLAND HOLD,Styland Holdings Limited,HKG
1124,0212.HK,Real Estate,Real Estate Services,5000,0.98415,NANYANG HOLD,Nanyang Holdings Limited,HKG
1125,0213.HK,Consumer Cyclical,Luxury Goods,56004,0.27046,NATIONAL ELEC H,National Electronics Holdings Limited,HKG
1126,0214.HK,Financial Services,Asset Management,72000,0.27166998,ASIA ORIENT,Asia Orient Holdings Limited,HKG
1127,0215.HK,Communication Services,Telecom Services,649203,0.0615,HUTCHTEL HK,Hutchison Telecommunications Hong Kong Holdings Limited,HKG
1128,0216.HK,Real Estate,Real Estate—Development,48000,0.81222,CHINNEY INV,"Chinney Investments, Limited",HKG
1129,0217.HK,Financial Services,Capital Markets,8000,0.13625,CHINA CHENGTONG,China Chengtong Development Group Limited,HKG
1130,0218.HK,Financial Services,Capital Markets,100000,0.20737,SWHYHK,Shenwan Hongyuan (H.K.) Limited,HKG
1131,0219.HK,Consumer Cyclical,Lodging,231,0.52437,SHUNHO PROPERTY,Shun Ho Property Investments Limited,HKG
1132,0220.HK,Consumer Defensive,Beverages—Non-Alcoholic,2422000,0.05963,U-PRESID CHINA,Uni-President China Holdings Ltd,HKG
1133,0221.HK,Real Estate,Real Estate—Development,643960,0.19077,EASY ONE FIN,Easy One Financial Group Limited,HKG
1134,0222.HK,Financial Services,Insurance—Property & Casualty,8000,1.39944,MIN XIN HOLD,Min Xin Holdings Limited,HKG
1135,0224.HK,Real Estate,Real Estate Services,12000,0.97556,PIONEER GLOBAL,Pioneer Global Group Limited,HKG
1136,0225.HK,Real Estate,Real Estate Services,6000,1.00743,POKFULAM,Pokfulam Development Company Limited,HKG
1137,0226.HK,Consumer Defensive,Food Distribution,25000,0.16231,LIPPO,Lippo Limited,HKG
1138,0227.HK,Financial Services,Capital Markets,120000,0.064770006,FIRST SHANGHAI,First Shanghai Investments Limited,HKG
1139,0228.HK,Energy,Oil & Gas Integrated,2906000,-0.57612,CHINA ENERGY,China Energy Development Holdings Limited,HKG
1140,0229.HK,Technology,Consumer Electronics,63000,0.027379999,RAYMOND IND,Raymond Industrial Limited,HKG
1141,0230.HK,Real Estate,Real Estate—Development,1760000,0.11883,MINMETALS LAND,Minmetals Land Limited,HKG
1142,0231.HK,Financial Services,Capital Markets,2345009,0.0,PING AN SEC GP,Ping An Securities Group (Holdings) Limited,HKG
1143,0232.HK,Industrials,Aerospace & Defense,7178000,0.36714,AVIC INT'L,AVIC International Holding (HK) Limited,HKG
1144,0234.HK,Consumer Cyclical,Leisure,1737600,0.18395,NEW CENTURY GP,New Century Group Hong Kong Limited,HKG
1145,0235.HK,Financial Services,Capital Markets,635000,0.13818,CHINA STRATEGIC,China Strategic Holdings Limited,HKG
1146,0236.HK,Consumer Defensive,Beverages—Brewers,170000,-0.12748,SAN MIGUEL HK,San Miguel Brewery Hong Kong Limited,HKG
1147,0237.HK,Real Estate,Real Estate Services,7040,0.68189,SAFETY GODOWN,"Safety Godown Company, Limited",HKG
1148,0238.HK,Consumer Cyclical,Apparel Manufacturing,232000,-0.41386002,EVERGREEN INT,Evergreen International Holdings Limited,HKG
1149,0239.HK,Healthcare,Drug Manufacturers—Specialty & Generic,20000,0.26107,PAK FAH YEOW,Pak Fah Yeow International Limited,HKG
1150,0240.HK,Industrials,Engineering & Construction,60000,0.05114,BUILD KING HOLD,Build King Holdings Limited,HKG
1151,0241.HK,Healthcare,Pharmaceutical Retailers,8148151,0.00014,ALI HEALTH,Alibaba Health Information Technology Limited,HKG
1152,0242.HK,Industrials,Conglomerates,2888384,0.4629,SHUN TAK HOLD,Shun Tak Holdings Limited,HKG
1153,0243.HK,Technology,Semiconductors,99000,-0.16065,QPL INT'L,QPL International Holdings Limited,HKG
1154,0244.HK,Consumer Cyclical,Department Stores,170000,-0.46936,SINCERE,"The Sincere Company, Limited",HKG
1155,0245.HK,Financial Services,Asset Management,30072600,-1.99719,CN MINSHENG FIN,China Minsheng Financial Holding Corporation Limited,HKG
1156,0247.HK,Real Estate,Real Estate Services,4000,0.40987,TST PROPERTIES,Tsim Sha Tsui Properties Limited,HKG
1157,0248.HK,Technology,Communication Equipment,32415,-0.01661,HKC INT'L HOLD,HKC International Holdings Limited,HKG
1158,0250.HK,Technology,Information Technology Services,400000,-0.01924,SINO-I TECH,Sino-i Technology Limited,HKG
1159,0251.HK,Real Estate,Real Estate—Diversified,82000,0.15908,SEA HOLDINGS,S E A Holdings Limited,HKG
1160,0252.HK,Consumer Cyclical,Packaging & Containers,20000,-0.1752,SE ASIA PPT,Southeast Asia Properties & Finance Limited,HKG
1161,0253.HK,Consumer Cyclical,Lodging,2200,0.2682,SHUNHO HOLDINGS,Shun Ho Holdings Limited,HKG
1162,0255.HK,Industrials,Metal Fabrication,12000,0.050019998,LUNG KEE,Lung Kee (Bermuda) Holdings Limited,HKG
1163,0256.HK,Consumer Cyclical,Luxury Goods,3714000,0.04088,CITYCHAMP,Citychamp Watch & Jewellery Group Limited,HKG
1164,0257.HK,Industrials,Waste Management,4663850,0.14995,CHINA EB INT'L,China Everbright International Limited,HKG
1165,0258.HK,Real Estate,Real Estate—Diversified,430000,0.30313,TOMSON GROUP,Tomson Group Limited,HKG
1166,0259.HK,Technology,Electronic Components,62000,0.30302998,YEEBO (INT'L H),Yeebo (International Holdings) Limited,HKG
1167,0260.HK,Energy,Oil & Gas Refining & Marketing,6950192,0.0,AVIC JOY HLDG,AVIC Joy Holdings (HK) Limited,HKG
1168,0261.HK,Technology,Communication Equipment,59680000,-0.27385,GBA INV HLDGS,Greater Bay Area Investments Group Holdings Limited,HKG
1169,0262.HK,Real Estate,Real Estate—Development,15000,0.070199996,DESON DEV INT'L,Deson Development International Holdings Limited,HKG
1170,0263.HK,Financial Services,Capital Markets,114200,0.0,GT GROUP HLDG,GT Group Holdings Limited,HKG
1171,0264.HK,Consumer Cyclical,Apparel Manufacturing,64000,-0.58397,ASCENT INT'L,Ascent International Holdings Limited,HKG
1172,0265.HK,Consumer Cyclical,Travel Services,540000,-0.21218,ORIENT VICTORY,Orient Victory Travel Group Company Limited,HKG
1173,0266.HK,Real Estate,Real Estate Services,120000,-0.34331,TIAN TECK LAND,Tian Teck Land Limited,HKG
1174,0267.HK,Industrials,Conglomerates,6725766,0.07478,CITIC,CITIC Limited,HKG
1175,0268.HK,Technology,Software—Application,6797556,0.11675,KINGDEE INT'L,Kingdee International Software Group Company Limited,HKG
1176,0269.HK,Industrials,Infrastructure Operations,2760000,-1.3026401,CRTG,China Resources and Transportation Group Limited,HKG
1177,0270.HK,Utilities,Utilities—Regulated Water,8000316,0.33413,GUANGDONG INV,Guangdong Investment Limited,HKG
1178,0271.HK,Real Estate,Real Estate Services,318597,1.3157201,ASIASEC PPT,Asiasec Properties Limited,HKG
1179,0272.HK,Real Estate,Real Estate—Development,5425816,0.14637999,SHUI ON LAND,Shui On Land Limited,HKG
1180,0273.HK,Consumer Defensive,Household & Personal Products,20240214,0.014099999,MASON GP HOLD,Mason Group Holdings Limited,HKG
1181,0274.HK,Basic Materials,Gold,1330000,-2.55452,C BILLION RES,China Billion Resources Limited,HKG
1182,0275.HK,Real Estate,Real Estate—Development,44000,-0.91573,MASTER GLORY GP,Master Glory Group Limited,HKG
1183,0276.HK,Energy,Thermal Coal,811252,-0.24279,MONGOLIA ENERGY,Mongolia Energy Corporation Limited,HKG
1184,0277.HK,Real Estate,Real Estate Services,1200,0.0,TERN PROPERTIES,Tern Properties Company Limited,HKG
1185,0278.HK,Real Estate,Real Estate Services,16000,0.69254994,WAH HA REALTY,Wah Ha Realty Company Limited,HKG
1186,0279.HK,Financial Services,Financial Conglomerates,444000,0.0,FREEMAN FINTECH,Freeman FinTech Corporation Limited,HKG
1187,0280.HK,Consumer Cyclical,Luxury Goods,142000,0.01328,KING FOOK HOLD,King Fook Holdings Limited,HKG
1188,0281.HK,Financial Services,Capital Markets,412000,30.60988,RIVERA (HOLD),Rivera (Holdings) Limited,HKG
1189,0282.HK,Communication Services,Publishing,4830000,-0.3035,NEXT DIGITAL,Next Digital Limited,HKG
1190,0285.HK,Technology,Communication Equipment,5935170,0.03635,BYD ELECTRONIC,BYD Electronic (International) Company Limited,HKG
1191,0286.HK,Healthcare,Medical Care Facilities,5800025,-0.012410001,CS HEALTH,Aidigong Maternal & Child Health Limited,HKG
1192,0287.HK,Real Estate,Real Estate Services,2000,2.62393,WINFAIR INV,Winfair Investment Company Limited,HKG
1193,0288.HK,Consumer Defensive,Packaged Foods,23535999,0.04423,WH GROUP,WH Group Limited,HKG
1194,0289.HK,Consumer Cyclical,Department Stores,39000,1.03847,WING ON CO,Wing On Company International Limited,HKG
1195,0290.HK,Financial Services,Capital Markets,2154000,-0.79289,C FORTUNE FIN,China Fortune Financial Group Limited,HKG
1196,0291.HK,Consumer Defensive,Beverages—Brewers,5997236,0.04045,CHINA RES BEER,China Resources Beer (Holdings) Company Limited,HKG
1197,0292.HK,Consumer Cyclical,Lodging,120000,0.35777,ASIA STD HOTEL,Asia Standard Hotel Group Limited,HKG
1198,8516.HK,Industrials,Engineering & Construction,55000,0.00899,GRAND TALENTS,Grand Talents Group Holdings Limited,HKG
1199,8519.HK,Consumer Cyclical,Restaurants,10000,-0.08786,JIA GROUP,Jia Group Holdings limited,HKG
1200,8521.HK,Consumer Cyclical,Textile Manufacturing,1725000,0.18245001,ST INTL HLDGS,ST International Holdings Company Limited,HKG
1201,8522.HK,Industrials,Engineering & Construction,364000,0.034649998,GAIN PLUS HLDGS,Gain Plus Holdings Limited,HKG
1202,8523.HK,Industrials,Engineering & Construction,50000,0.06894,SHEUNG MOON,Sheung Moon Holdings Limited,HKG
1203,8525.HK,Financial Services,Credit Services,12000,0.44198,BYLEASING,Byleasing Holdings Limited,HKG
1204,8526.HK,Industrials,Building Products & Equipment,300000,0.07452,WING FUNG GROUP,Wing Fung Group Asia Limited,HKG
1205,8527.HK,Consumer Cyclical,Restaurants,15000,-0.11532,JLOGO HLDGS,JLogo Holdings Limited,HKG
1206,8532.HK,Industrials,Engineering & Construction,144000,-0.010650001,POLYFAIR HLDGS,Polyfair Holdings Limited,HKG
1207,8535.HK,Industrials,Security & Protection Services,60000,0.0461,VISTAR HOLDINGS,Vistar Holdings Limited,HKG
1208,8536.HK,Consumer Cyclical,Specialty Retail,2000000,0.07176,TL NATURAL GAS,TL Natural Gas Holdings Limited,HKG
1209,8537.HK,Consumer Cyclical,Luxury Goods,260000,0.009190001,DOMINATE GP,Dominate Group Holdings Company Limited,HKG
1210,8540.HK,Financial Services,Capital Markets,20000,0.14994,VICTORY SEC,Victory Securities (Holdings) Company Limited,HKG
1211,8545.HK,Consumer Cyclical,Leisure,112000,0.058569998,AMUSE GROUP,Amuse Group Holding Limited,HKG
1212,8547.HK,Consumer Cyclical,"Furnishings, Fixtures & Appliances",100000,-0.022049999,PACIFIC LEGEND,Pacific Legend Group Limited,HKG
1213,8603.HK,Consumer Defensive,Household & Personal Products,500000,0.02557,FAMEGLOW,Fameglow Holdings Limited,HKG
1214,8606.HK,Technology,Information Technology Services,2030000,0.039470002,KINETIX SYSTEMS,Kinetix Systems Holdings Limited,HKG
1215,8607.HK,Consumer Cyclical,Textile Manufacturing,515000,0.09752,NARNIA GROUP,Narnia (Hong Kong) Group Company Limited,HKG
1216,8609.HK,Consumer Defensive,Packaged Foods,210000,0.09702,EGGRICULTURE,Eggriculture Foods Ltd.,HKG
1217,8611.HK,Technology,Information Technology Services,205000,-0.07716,MINDTELL TECH,Mindtell Technology Limited,HKG
1218,8612.HK,Industrials,Rental & Leasing Services,150000,0.15838,WORLD SUPER,World Super Holdings Limited,HKG
1219,8613.HK,Technology,Software—Infrastructure,10000,-0.0684,ORIENTAL PAY,Oriental Payment Group Holdings Limited,HKG
1220,1929.HK,Consumer Cyclical,Luxury Goods,3965800,0.06276,CHOW TAI FOOK,Chow Tai Fook Jewellery Group Limited,HKG
1221,1930.HK,Consumer Cyclical,Auto Parts,5940000,0.08319,SHINELONG,Shinelong Automotive Lightweight Application Limited,HKG
1222,1931.HK,Healthcare,Diagnostics & Research,769000,0.36418998,IVD MEDICAL,IVD Medical Holding Limited,HKG
1223,1932.HK,Basic Materials,Specialty Chemicals,40000,-0.17153,CPM GROUP,CPM Group Limited,HKG
1224,1933.HK,Technology,Software—Application,8000,0.1397,ONEFORCE HLDGS,OneForce Holdings Limited,HKG
1225,1935.HK,Consumer Defensive,Education & Training Services,78000,0.4307,JH EDUCATION,JH Educational Technology INC.,HKG
1226,1938.HK,Basic Materials,Steel,100000,-0.24347,CHU KONG PIPE,Chu Kong Petroleum and Natural Gas Steel Pipe Holdings Limited,HKG
1227,1939.HK,Consumer Cyclical,Specialty Retail,110000,0.16499001,TOKYO CHUO,Tokyo Chuo Auction Holdings Limited,HKG
1228,1943.HK,Basic Materials,Building Materials,10000,0.04186,SILVER TIDE,Silver Tide Holdings Limited,HKG
1229,1949.HK,Technology,Information Technology Services,588000,0.09146,PLATT NERA,Platt Nera International Limited,HKG
1230,1951.HK,Healthcare,Medical Care Facilities,4561313,0.20695,JXR,Jinxin Fertility Group Limited,HKG
1231,1955.HK,Industrials,Specialty Business Services,332000,0.01502,JOHNSON HLDGS,"Hong Kong Johnson Holdings Co., Ltd.",HKG
1232,1958.HK,Consumer Cyclical,Auto Manufacturers,4137951,0.022720002,BAIC MOTOR,BAIC Motor Corporation Limited,HKG
1233,3606.HK,Consumer Cyclical,Auto Parts,439791,0.15456,FUYAO GLASS,"Fuyao Glass Industry Group Co., Ltd.",HKG
1234,3608.HK,Consumer Cyclical,Textile Manufacturing,40000,0.099589996,YONGSHENG MAT,Yongsheng Advanced Materials Company Limited,HKG
1235,3613.HK,Healthcare,Pharmaceutical Retailers,1046000,0.40067002,TONGRENTANGCM,Beijing Tong Ren Tang Chinese Medicine Company Limited,HKG
1236,3616.HK,Real Estate,Real Estate—Development,172000,0.118669994,EVER REACH GP,Ever Reach Group (Holdings) Company Limited,HKG
1237,3618.HK,Financial Services,Banks—Regional,4321000,0.5041,CQRC BANK,"Chongqing Rural Commercial Bank Co., Ltd.",HKG
1238,3623.HK,Financial Services,Financial Conglomerates,10000,-0.05846,C SUCCESS FIN,China Success Finance Group Holdings Limited,HKG
1239,3626.HK,Industrials,Specialty Business Services,100000,0.02026,HSSP INTL,Hang Sang (Siu Po) International Holding Company Limited,HKG
1240,3628.HK,Industrials,Specialty Industrial Machinery,16000,0.09380999,RENHENG ENT,RENHENG Enterprise Holdings Limited,HKG
1241,3633.HK,Utilities,Utilities—Regulated Gas,535000,0.08582,ZHONGYU GAS,Zhongyu Gas Holdings Limited,HKG
1242,3636.HK,Consumer Cyclical,Specialty Retail,15700,0.059159998,POLY CULTURE,Poly Culture Group Corporation Limited,HKG
1243,3638.HK,Technology,Computer Hardware,12000,-0.060949996,HUABANG FIN,Huabang Financial Holdings Limited,HKG
1244,3639.HK,Real Estate,Real Estate—Development,8000,0.08874,YIDA CHINA,Yida China Holdings Limited,HKG
1245,3662.HK,Real Estate,Real Estate Services,2417732,0.17804001,AOYUAN HEALTHY,Aoyuan Healthy Life Group Company Limited,HKG
1246,3663.HK,Consumer Cyclical,Auto Parts,20000,-0.07305,XIEZHONG INTL,Xiezhong International Holdings Limited,HKG
1247,3666.HK,Consumer Cyclical,Restaurants,42000,-0.096219994,TANSH,"TANSH Global Food Group Co., Ltd",HKG
1248,3668.HK,Energy,Thermal Coal,700,0.21702999,YANCOAL AUS,Yancoal Australia Ltd,HKG
1249,3669.HK,Consumer Cyclical,Auto & Truck Dealerships,9105530,0.021240002,YONGDA AUTO,China Yongda Automobiles Services Holdings Limited,HKG
1250,3678.HK,Financial Services,Capital Markets,30000,0.29549,HOLLY FUTURES,"Holly Futures Co., Ltd.",HKG
1251,1415.HK,Technology,Electronic Components,2730000,0.03615,COWELL,Cowell e Holdings Inc.,HKG
1252,1417.HK,Real Estate,Real Estate Services,122000,0.05215,RIVERINE CHINA,Riverine China Holdings Limited,HKG
1253,1418.HK,Consumer Cyclical,"Furnishings, Fixtures & Appliances",620000,0.00029,SINOMAX GROUP,Sinomax Group Limited,HKG
1254,1419.HK,Healthcare,Medical Care Facilities,52000,0.05037,HUMAN HEALTH,Human Health Holdings Limited,HKG
1255,1420.HK,Industrials,Engineering & Construction,280000,0.02744,CHUAN HOLDING,Chuan Holdings Limited,HKG
1256,1421.HK,Technology,Solar,3335000,-0.10896,KINGBO STRIKE,Kingbo Strike Limited,HKG
1257,0294.HK,Consumer Cyclical,Apparel Manufacturing,276,0.00274,YANGTZEKIANG,Yangtzekiang Garment Limited,HKG
1258,0295.HK,Utilities,Utilities—Renewable,3750000,-0.01881,KONG SUN HOLD,Kong Sun Holdings Limited,HKG
1259,0296.HK,Consumer Cyclical,Resorts & Casinos,90,0.29830998,EMPEROR E HOTEL,Emperor Entertainment Hotel Limited,HKG
1260,0297.HK,Basic Materials,Agricultural Inputs,2246000,0.024600001,SINOFERT,Sinofert Holdings Limited,HKG
1261,0298.HK,Real Estate,Real Estate—Development,310000,0.61532,CHUANG'S CHINA,Chuang's China Investments Limited,HKG
1262,0299.HK,Financial Services,Capital Markets,205000,-0.00949,GLORY SUN LAND,Glory Sun Land Group Limited,HKG
1263,0302.HK,Communication Services,Electronic Gaming & Multimedia,6160000,0.16666001,CMGE,CMGE Technology Group Limited,HKG
1264,0303.HK,Technology,Communication Equipment,442095,0.08727,VTECH HOLDINGS,Vtech Holdings Limited,HKG
1265,0305.HK,Consumer Cyclical,Auto Manufacturers,520000,0.0014200001,WULING MOTORS,Wuling Motors Holdings Limited,HKG
1266,0306.HK,Industrials,Railroads,8000,0.069120005,KWOON CHUNG BUS,Kwoon Chung Bus Holdings Limited,HKG
1267,0308.HK,Consumer Cyclical,Leisure,3508000,0.15607001,CHINA TRAVEL HK,China Travel International Investment Hong Kong Limited,HKG
1268,0309.HK,Industrials,Specialty Business Services,371000,0.01672,XH NEWS MEDIA,Xinhua News Media Holdings Limited,HKG
1269,0310.HK,Financial Services,Capital Markets,2535000,0.0,PROSP INV HOLD,Prosperity Investment Holdings Limited,HKG
1270,0311.HK,Consumer Cyclical,Apparel Manufacturing,2000,0.02228,LUEN THAI,Luen Thai Holdings Limited,HKG
1271,0312.HK,Consumer Cyclical,Department Stores,1182000,0.12538,SHIRBLE STORE,Shirble Department Store Holdings (China) Limited,HKG
1272,0313.HK,Real Estate,Real Estate Services,10500000,-0.55237997,RICHLY FIELD,Richly Field China Development Limited,HKG
1273,0315.HK,Communication Services,Telecom Services,797500,0.07513,SMARTONE TELE,SmarTone Telecommunications Holdings Limited,HKG
1274,0316.HK,Industrials,Marine Shipping,72400,0.0381,OOIL,Orient Overseas (International) Limited,HKG
1275,0317.HK,Industrials,Aerospace & Defense,619800,-0.063,COMEC,CSSC Offshore & Marine Engineering (Group) Company Limited,HKG
1276,0318.HK,Financial Services,Capital Markets,55000,0.63246,VONGROUP,Vongroup Limited,HKG
1277,8098.HK,Financial Services,Capital Markets,10000,0.23214,CL GROUP,CL Group (Holdings) Limited,HKG
1278,8100.HK,Technology,Information Technology Services,36000,-0.35137,GET HOLDINGS,GET Holdings Limited,HKG
1279,8101.HK,Consumer Cyclical,"Furnishings, Fixtures & Appliances",2708000,-0.24259001,EJE HOLDINGS,EJE (Hong Kong) Holdings Limited,HKG
1280,8103.HK,Technology,Information Technology Services,2628000,-0.54847,HMVOD,hmvod Limited,HKG
1281,8105.HK,Consumer Defensive,Education & Training Services,425000,0.045619998,KINGSLEY EDU,Kingsley Edugroup Limited,HKG
1282,8106.HK,Technology,Electronics & Computer Distribution,13075000,0.02343,SHENGHUA LANDE,Shenghua Lande Scitech Limited,HKG
1283,8107.HK,Consumer Cyclical,Apparel Manufacturing,10000,0.11918,VISION INT HLDG,Vision International Holdings Limited,HKG
1284,8108.HK,Consumer Cyclical,Personal Services,266000,-0.8628,GRAND PEACE,Grand Peace Group Holdings Limited,HKG
1285,8109.HK,Financial Services,Insurance Brokers,9515050,-0.47151002,KIRIN GROUP,Kirin Group Holdings Limited,HKG
1286,8111.HK,Technology,Solar,90000,-0.24379,CT SOLARPOWER,China Technology Solar Power Holdings Limited,HKG
1287,8113.HK,Technology,Electronic Components,720,-0.00032000002,HI-LEVEL TECH,Hi-Level Technology Holdings Limited,HKG
1288,8115.HK,Industrials,Specialty Industrial Machinery,40000,-0.06822,SHANGHAI QINGPU,"Shanghai Qingpu Fire-Fighting Equipment Co., Ltd.",HKG
1289,0968.HK,Technology,Solar,14389090,0.21384001,XINYI SOLAR,Xinyi Solar Holdings Limited,HKG
1290,0969.HK,Consumer Defensive,Confectioners,20000,-0.50518,HUA LIEN INT'L,Hua Lien International (Holding) Company Limited,HKG
1291,0970.HK,Consumer Cyclical,Auto & Truck Dealerships,456000,0.03416,SPARKLE ROLL,Sparkle Roll Group Limited,HKG
1292,0973.HK,Consumer Defensive,Household & Personal Products,345000,0.08748999,L'OCCITANE,L'Occitane International S.A.,HKG
1293,0974.HK,Consumer Defensive,Grocery Stores,77000,5e-05,SKL,China Shun Ke Long Holdings Limited,HKG
1294,0975.HK,Basic Materials,Coking Coal,350000,0.15577,MONGOL MINING,Mongolian Mining Corporation,HKG
1295,0976.HK,Industrials,Metal Fabrication,218000,0.00386,CHIHO ENV,Chiho Environmental Group Limited,HKG
1296,0978.HK,Real Estate,Real Estate—Diversified,304000,0.110249996,CHI MER LAND,China Merchants Land Limited,HKG
1297,0979.HK,Industrials,Waste Management,294050,-0.26723,GREEN ENERGY GP,Green Energy Group Limited,HKG
1298,0980.HK,Consumer Cyclical,Department Stores,26600,-0.0083,LIANHUA,"Lianhua Supermarket Holdings Co., Ltd.",HKG
1299,0981.HK,Technology,Semiconductors,74154900,0.05629,SMIC,Semiconductor Manufacturing International Corporation,HKG
1300,0983.HK,Real Estate,Real Estate—Development,292000,-0.00927,SOCAM DEV,SOCAM Development Limited,HKG
1301,0984.HK,Consumer Cyclical,Department Stores,75000,-0.01544,AEON STORES,"AEON Stores (Hong Kong) Co., Limited",HKG
1302,0985.HK,Basic Materials,Copper,5082240,-0.50956,CST GROUP,CST Group Limited,HKG
1303,0987.HK,Utilities,Utilities—Renewable,513192,0.30051002,CH RENEW EN INV,China Renewable Energy Investment Limited,HKG
1304,0988.HK,Basic Materials,Industrial Metals & Minerals,30141,-0.11189,SILKROAD LOG,Silk Road Logistics Holdings Limited,HKG
1305,0989.HK,Real Estate,Real Estate—Development,1545000,-0.71235,GROUND INTL DEV,Ground International Development Limited,HKG
1306,0990.HK,Basic Materials,Steel,3220000,0.02227,THEME INT'L,Theme International Holdings Limited,HKG
1307,0991.HK,Utilities,Utilities—Independent Power Producers,8430000,0.01013,DATANG POWER,"Datang International Power Generation Co., Ltd.",HKG
1308,1960.HK,Industrials,Engineering & Construction,7215000,0.08417,TBKS HLDGS,TBK & Sons Holdings Limited,HKG
1309,1962.HK,Consumer Defensive,Household & Personal Products,532000,0.14739001,EVERGREEN PG,Evergreen Products Group Limited,HKG
1310,1963.HK,Financial Services,Banks—Regional,456500,0.52819,BCQ,"Bank of Chongqing Co., Ltd.",HKG
1311,1966.HK,Real Estate,Real Estate—Development,18823600,0.17804001,CHINA SCE GROUP,China SCE Group Holdings Limited,HKG
1312,3683.HK,Industrials,Marine Shipping,235000,-0.22769,GREAT HARVEST,Great Harvest Maeta Group Holdings Limited,HKG
1313,3686.HK,Consumer Defensive,Grocery Stores,380000,0.22528,CLIFFORDML,Clifford Modern Living Holdings Limited,HKG
1314,3688.HK,Real Estate,Real Estate—Development,91000,-0.059299998,TOP SPRING,Top Spring International Holdings Limited,HKG
1315,3689.HK,Healthcare,Medical Care Facilities,17000,0.082609996,KANGHUA HEALTH,"Guangdong Kanghua Healthcare Co., Ltd.",HKG
1316,3690.HK,Consumer Cyclical,Internet Retail,19245424,-0.029679999,MEITUAN-W,Meituan Dianping,HKG
1317,3692.HK,Healthcare,Drug Manufacturers—Specialty & Generic,1422000,0.25233,HANSOH PHARMA,Hansoh Pharmaceutical Group Company Limited,HKG
1318,3698.HK,Financial Services,Banks—Regional,1428000,0.51421,HUISHANG BANK,Huishang Bank Corporation Limited,HKG
1319,3699.HK,Real Estate,Real Estate Services,2010,0.38641998,EB GRAND CHINA,Everbright Grand China Assets Limited,HKG
1320,3700.HK,Communication Services,Advertising Agencies,604000,0.03822,INKE,Inke Limited,HKG
1321,3708.HK,Consumer Cyclical,Residential Construction,805000,-0.03227,YAT SING HLDG,Yat Sing Holdings Limited,HKG
1322,3709.HK,Consumer Cyclical,Apparel Manufacturing,1177000,0.10972,EEKA FASHION,EEKA Fashion Holdings Limited,HKG
1323,3728.HK,Industrials,Engineering & Construction,6260000,0.011729999,CHING LEE,Ching Lee Holdings Limited,HKG
1324,3737.HK,Healthcare,Drug Manufacturers—Specialty & Generic,128000,0.07946,ZHONGZHIPHARM,Zhongzhi Pharmaceutical Holdings Limited,HKG
1325,3738.HK,Technology,Software—Application,4334900,-0.2394,VOBILE GROUP,Vobile Group Limited,HKG
1326,3759.HK,Healthcare,Biotechnology,1872400,0.12662,PHARMARON,"Pharmaron Beijing Co., Ltd.",HKG
1327,3768.HK,Utilities,Utilities—Regulated Water,190000,0.23045999,DCWT,"Kunming Dianchi Water Treatment Co., Ltd.",HKG
1328,3773.HK,Technology,Software—Infrastructure,564000,-0.21406999,NNK,NNK Group Limited,HKG
1329,3778.HK,Consumer Cyclical,Textile Manufacturing,412000,0.03833,CHINA WEAVING,China Weaving Materials Holdings Limited,HKG
1330,3788.HK,Basic Materials,Other Industrial Metals & Mining,188000,0.04996,CHINA HANKING,China Hanking Holdings Limited,HKG
1331,8117.HK,Energy,Oil & Gas Midstream,20000,-0.01518,CHI P ENERGY,China Primary Energy Holdings Limited,HKG
1332,8118.HK,Consumer Cyclical,"Furnishings, Fixtures & Appliances",8000,0.14991,BORTEX GLOBAL,Bortex Global Limited,HKG
1333,8119.HK,Technology,Software—Application,860000,-0.17929001,THIZ TECHNOLOGY,Thiz Technology Group Limited,HKG
1334,8120.HK,Consumer Defensive,Farm Products,11245000,-0.62477,CH DEMETER FIN,China Demeter Financial Investments Limited,HKG
1335,8121.HK,Communication Services,Advertising Agencies,20000,-0.11229999,GURU ONLINE,Guru Online (Holdings) Limited,HKG
1336,8123.HK,Financial Services,Capital Markets,162000,-0.43415,SINOFORTUNE FIN,Sinofortune Financial Holdings Limited,HKG
